"id","tmdb_id","media_type","title","rating","tmdb_backdrop","tmdb_poster","release_date","overview","createdAt","updatedAt"
334,33,"movie","Unforgiven",7.8,"https://image.tmdb.org/t/p/w780/nKYH8DaWjKE3RhEyaa0Ue01kPCp.jpg","https://image.tmdb.org/t/p/w780/km6qw4qUkHQRN5y2U1juM1WkBFh.jpg","1992-08-07","William Munny is a retired, once-ruthless killer turned gentle widower and hog farmer. To help support his two motherless children, he accepts one last bounty-hunter mission to find the men who brutalized a prostitute. Joined by his former partner and a cocky greenhorn, he takes on a corrupt sheriff.","2017-12-11 16:51:24.685-05","2017-12-11 16:51:24.685-05"
335,9576,"movie","Tootsie",6.9,"https://image.tmdb.org/t/p/w780/74Jh5SIWnKDwtusPfDP51EeCFHt.jpg","https://image.tmdb.org/t/p/w780/ngyCzZwb9y5sMUCig5JQT4Y33Q.jpg","1982-12-16","Michael Dorsey is an unemployed actor with an impossible reputation. In order to find work and fund his friend's play he dresses as a woman, Dorothy Michaels, and lands the part in a daytime drama. Dorsey loses himself in this woman role and essentially becomes Dorothy Michaels, captivating women all around the city and inspiring them to break free from the control of men and become more like Dorsey's initial identity. This newfound role, however, lands Dorsey in a hot spot between a female friend/'lover,' a female co-star he falls in love with, that co-star's father who falls in love with him, and a male co-star who yearns for his affection.","2017-12-11 16:51:26.187-05","2017-12-11 16:51:26.187-05"
336,638,"movie","Lost Highway",7.5,"https://image.tmdb.org/t/p/w780/zXSnRqXzM4OR9yNtenZ3dn6AFts.jpg","https://image.tmdb.org/t/p/w780/z6yhgEzGUJaBBgAxoyggRzwLnVM.jpg","1997-01-15","A tormented jazz musician finds himself lost in an enigmatic story involving murder, surveillance, gangsters, doppelgangers, and an impossible transformation inside a prison cell.","2017-12-11 16:51:29.198-05","2017-12-11 16:51:29.198-05"
337,13697,"movie","Grand Canyon",6.8,"https://image.tmdb.org/t/p/w780/5YAWqAf5NrvZKnlxKUK15kKi5Jl.jpg","https://image.tmdb.org/t/p/w780/zRgzeFhX7NuAWNsMuAoLEKI1n0R.jpg","1991-12-25","Grand Canyon revolved around six residents from different backgrounds whose lives intertwine in modern-day Los Angeles. At the center of the film is the unlikely friendship of two men from different races and classes brought together when one finds himself in jeopardy in the other's rough neighborhood.","2017-12-11 16:51:30.707-05","2017-12-11 16:51:30.707-05"
339,72387,"movie","Safe",6.3,"https://image.tmdb.org/t/p/w780/eZ7XAU70UcMvMsDajqphFeQNQ8S.jpg","https://image.tmdb.org/t/p/w780/eoiqqDHohBCDwFWQOvczUeNoixK.jpg","2012-04-16","After a former elite agent rescues a 12-year-old Chinese girl who's been abducted, they find themselves in the middle of a standoff between Triads, the Russian Mafia and high-level corrupt New York City politicians and police.","2017-12-11 16:51:33.688-05","2017-12-11 16:51:33.688-05"
340,108401,"movie","Star Maps",5.3,,"https://image.tmdb.org/t/p/w780/oX3LxA4bg6U9HuGEcHL5wCiiLAC.jpg","1997-07-23","Carlos wants to be an actor. But his father, Pepe, wants him to work in the family business, that is, male prostitution. Carlos decides that he will be one of his father's boys until he can get his foot in the door in Hollywood.","2017-12-11 16:51:35.173-05","2017-12-11 16:51:35.173-05"
341,274906,"movie","The 50 Year Argument",7.3,"https://image.tmdb.org/t/p/w780/dlB2QavyWtnSnsepB25igKYWuBJ.jpg","https://image.tmdb.org/t/p/w780/4vgaBO4xsGTP6erS5ZTjHkzUBeW.jpg","2014-06-29","Directed by acclaimed filmmaker Martin Scorsese and his longtime documentary collaborator David Tedeschi, A 50 Year Argument rides the waves of literary, political, and cultural history as charted by the The New York Review of Books, America’s leading journal of ideas for over 50 years. Provocative, idiosyncratic and incendiary, the film weaves rarely seen archival material, contributor interviews, excerpts from writings by such icons as James Baldwin, Gore Vidal, and Joan Didion along with original verité footage filmed in the Review’s West Village offices. Confrontation and original argument are in the Review's DNA - the magazine seems as vital now as when it was run by its indefatigable founding editors, Robert Silvers and the late Barbara Epstein. Co-produced with the BBC's award-winning Arena and shaped by Scorcese's vivid filmmaking style, The Fifty Year Argument captures the power of ideas in influencing history.","2017-12-11 16:51:36.684-05","2017-12-11 16:51:36.684-05"
342,14662,"movie","Slums of Beverly Hills",6.5,"https://image.tmdb.org/t/p/w780/l3cjRFKXaZR94dlhKsq8rQRwSpG.jpg","https://image.tmdb.org/t/p/w780/u0690Aor60ZM7Zhg6rwUD1KvJOr.jpg","1998-08-14","In 1976, a lower-middle-class teenager struggles to cope living with her neurotic family of nomads on the outskirts of Beverly Hills.","2017-12-11 16:51:38.175-05","2017-12-11 16:51:38.175-05"
343,453,"movie","A Beautiful Mind",7.7,"https://image.tmdb.org/t/p/w780/5YF6MwuuKBRKLUE2dz3wetkgxAE.jpg","https://image.tmdb.org/t/p/w780/4SFqHDZ1NvWdysucWbgnYlobdxC.jpg","2001-12-11","At Princeton University, John Nash struggles to make a worthwhile contribution to serve as his legacy to the world of mathematics. He finally makes a revolutionary breakthrough that will eventually earn him the Nobel Prize. After graduate school he turns to teaching, becoming romantically involved with his student Alicia. Meanwhile the government asks his help with breaking Soviet codes, which soon gets him involved in a terrifying conspiracy plot. Nash grows more and more paranoid until a discovery that turns his entire world upside down. Now it is only with Alicia's help that he will be able to recover his mental strength and regain his status as the great mathematician we know him as today..","2017-12-11 16:51:47.277-05","2017-12-11 16:51:47.277-05"
345,11156,"movie","Coco Before Chanel",6.7,"https://image.tmdb.org/t/p/w780/oFLVwodlGWqJVugf2vzqdfl4MI0.jpg","https://image.tmdb.org/t/p/w780/c0K9vPufKe9gv0EbM9kkVniZ8H5.jpg","2009-04-22","2009 biopic about the early life of Coco Chanel. Several years after leaving the orphanage, to which her father never returned for her, Gabrielle Chanel finds herself working in a provincial bar both. She's both a seamstress for the performers and a singer, earning the nickname Coco from the song she sings nightly with her sister. A liaison with Baron Balsan gives her an entree into French society and a chance to develop her gift for designing.","2017-12-11 16:51:54.686-05","2017-12-11 16:51:54.686-05"
346,149,"movie","Akira",7.8,"https://image.tmdb.org/t/p/w780/wtwn4pSFZhm665cQIHFmBjmgMEC.jpg","https://image.tmdb.org/t/p/w780/8Pt7hlu7fkc5IIR0VZ2kNGY8sT4.jpg","1988-07-16","Childhood friends Tetsuo and Kaneda are pulled into the post-apocalyptic underworld of Neo-Tokyo and forced to fight for their very survival. Kaneda is a bike gang leader, and Tetsuo is a member of a tough motorcycle crew who becomes involved in a covert government project called Akira. But a bloody battle ensues when Kaneda sets out to save his friend.","2017-12-11 16:51:56.203-05","2017-12-11 16:51:56.203-05"
348,10868,"movie","The Accused",6.8,"https://image.tmdb.org/t/p/w780/vHTe93OxRobmzaH2AkPGwWiyTGz.jpg","https://image.tmdb.org/t/p/w780/pnVcMHjcNCJ7u3pokJGAXVpJT7D.jpg","1988-10-14","After a young woman suffers a brutal rape in a bar one night, a prosecutor assists in bringing the perpetrators to justice, including the ones who encouraged and cheered on the attack.","2017-12-11 16:51:59.181-05","2017-12-11 16:51:59.181-05"
349,1538,"movie","Collateral",7,"https://image.tmdb.org/t/p/w780/whhU7492W0fcZE73r1HNhfyc5uV.jpg","https://image.tmdb.org/t/p/w780/fmkv2eRuYCTq7A5jzMBNgoNe1vA.jpg","2004-08-04","Cab driver Max picks up a man who offers him $600 to drive him around. But the promise of easy money sours when Max realizes his fare is an assassin.","2017-12-11 16:52:00.685-05","2017-12-11 16:52:00.685-05"
351,1646,"movie","Freedom Writers",7.6,"https://image.tmdb.org/t/p/w780/hilAvXZyFhSo5akvH0QXHOZQdgD.jpg","https://image.tmdb.org/t/p/w780/bffP9cAgOHsMNnc55zIXrDnz7QD.jpg","2007-01-05","A young teacher inspires her class of at-risk students to learn tolerance, apply themselves, and pursue education beyond high school.","2017-12-11 16:52:03.685-05","2017-12-11 16:52:03.685-05"
353,9696,"movie","Ichi the Killer",7,"https://image.tmdb.org/t/p/w780/bma7e5YWIcvsy1tEuYqEHVY7qO7.jpg","https://image.tmdb.org/t/p/w780/mkmwESVpq7KrcxdPMreTFqlNF0S.jpg","2001-12-22","As sadomasochistic yakuza enforcer Kakihara searches for his missing boss he comes across Ichi, a repressed and psychotic killer who may be able to inflict levels of pain that Kakihara has only dreamed of.","2017-12-11 16:52:09.681-05","2017-12-11 16:52:09.681-05"
354,11075,"movie","Audition",6.9,"https://image.tmdb.org/t/p/w780/erYnALHXFCzDwIDFthyOoGiLfsg.jpg","https://image.tmdb.org/t/p/w780/mrK8hwRqaR1lveGoIcBICBqdmTG.jpg","1999-10-06","Seven years after the death of his wife, company executive Aoyama is invited to sit in on auditions for an actress. Leafing through the resumés in advance, his eye is caught by Yamazaki Asami, a striking young woman with ballet training.","2017-12-11 16:52:11.193-05","2017-12-11 16:52:11.193-05"
355,24804,"movie","Black Dynamite",7.2,"https://image.tmdb.org/t/p/w780/djAPYuSYADWXM6OqvxheZYwOT3C.jpg","https://image.tmdb.org/t/p/w780/eMpxFQuEwU4HRA4SOfEpZKAtPxb.jpg","2009-10-16","This is the story of 1970s African-American action legend Black Dynamite. The Man killed his brother, pumped heroin into local orphanages, and flooded the ghetto with adulterated malt liquor. Black Dynamite was the one hero willing to fight The Man all the way from the blood-soaked city streets to the hallowed halls of the Honky House...","2017-12-11 16:52:12.719-05","2017-12-11 16:52:12.719-05"
356,36691,"movie","Solitary Man",5.8,"https://image.tmdb.org/t/p/w780/ftNxKAdn2IoRkHBCvARpwbvqa4i.jpg","https://image.tmdb.org/t/p/w780/ivKFRGUewkP3kMEq5RrnzSwYX2t.jpg","2009-09-07","A car magnate watches his personal and professional life hit the skids because of his business and romantic indiscretions.","2017-12-11 16:52:17.191-05","2017-12-11 16:52:17.191-05"
357,192145,"movie","Third Person",5.8,"https://image.tmdb.org/t/p/w780/wsTFhxSdD2kgH1pMeMNKVzGNfXI.jpg","https://image.tmdb.org/t/p/w780/oC4kDRHQIhK0YwN78VelIaj0732.jpg","2013-09-09","An acclaimed novelist struggles to write an analysis of love in one of three stories, each set in a different city, that detail the beginning, middle and end of a relationship.","2017-12-11 16:52:18.684-05","2017-12-11 16:52:18.684-05"
358,10234,"movie","Funny Games",7.3,"https://image.tmdb.org/t/p/w780/rTEvTSaFk7OYTdmssot0b2g56wx.jpg","https://image.tmdb.org/t/p/w780/mISZcSru00OqBr9nTfdUrHLSmfE.jpg","1997-05-14","Two psychotic young men take a mother, father, and son hostage in their vacation cabin and force them to play sadistic ""games"" with one another for their own amusement.","2017-12-11 16:52:20.175-05","2017-12-11 16:52:20.175-05"
359,1407,"movie","La Vie en Rose",7.4,"https://image.tmdb.org/t/p/w780/qtNKkgb5mz2lETwhVUInK8KhMug.jpg","https://image.tmdb.org/t/p/w780/xJMbQkNKt85ZSIh4HucDwENL8dq.jpg","2007-02-08","A swirling, impressionistic portrait of an artist who regretted nothing, writer-director Olivier Dahan's La Vie en Rose stars Marion Cotillard in a blazing performance as the legendary French icon Edith Piaf. From the mean streets of the Belleville district of Paris to the dazzling limelight of New York's most famous concert halls, Piaf's life was a constant battle to sing and survive, to live and love. Raised in her grandmother's brothel, Piaf was discovered in 1935 by nightclub owner Louis Leplee (Gerard Depardieu), who persuaded her to sing despite her extreme nervousness. Piaf became one of France's immortal icons, her voice one of the indelible signatures of the 20th Century.","2017-12-11 16:52:24.684-05","2017-12-11 16:52:24.684-05"
360,92591,"movie","Bernie",6.5,"https://image.tmdb.org/t/p/w780/vtBvAKRWlvNCsdldduqBwy38oSB.jpg","https://image.tmdb.org/t/p/w780/yfYjg789qjxHCTTcyOqXtpoetQU.jpg","2012-04-27","In this true story in the tiny, rural town of Carthage, TX, assistant funeral director Bernie Tiede was one of the town's most beloved residents. Everyone loved and appreciated Bernie, and it came as no surprise when he befriended Marjorie Nugent, an affluent widow who was as well known for her sour attitude as her fortune. Until that day news came that Marjorie Nugent had been dead for some time, and Bernie Tiede was being charged with the murder.","2017-12-11 16:52:26.24-05","2017-12-11 16:52:26.24-05"
361,44639,"movie","Inside Job",7.7,"https://image.tmdb.org/t/p/w780/4HA3MLBmTf0sDqnw4BZlVDiOwG5.jpg","https://image.tmdb.org/t/p/w780/r4kzTrzuxapUVFPhocBXKQwEKm4.jpg","2010-10-08","A film that exposes the shocking truth behind the economic crisis of 2008. The global financial meltdown, at a cost of over $20 trillion, resulted in millions of people losing their homes and jobs. Through extensive research and interviews with major financial insiders, politicians and journalists, Inside Job traces the rise of a rogue industry and unveils the corrosive relationships which have corrupted politics, regulation and academia.","2017-12-11 16:52:29.179-05","2017-12-11 16:52:29.179-05"
362,10316,"movie","The Ides of March",6.5,"https://image.tmdb.org/t/p/w780/fWy4ATlV8T3mYKicihloXfBeVAd.jpg","https://image.tmdb.org/t/p/w780/xnYM774QZtouyApuLrd3VeSOVn1.jpg","2011-09-24","Dirty tricks stand to soil an ambitious young press spokesman's idealism in a cutthroat presidential campaign where 'victory' is relative.","2017-12-11 16:52:30.676-05","2017-12-11 16:52:30.676-05"
363,1809,"movie","The Rules of Attraction",6.4,"https://image.tmdb.org/t/p/w780/w2XgUins64EAD8wuQerq5vPTyGD.jpg","https://image.tmdb.org/t/p/w780/2VNthl67n1rALwB6mncDrh9Q9GV.jpg","2002-10-11","The incredibly spoiled and overprivileged students of Camden College are a backdrop for an unusual love triangle between a drug dealer, a virgin and a bisexual classmate.","2017-12-11 16:52:36.7-05","2017-12-11 16:52:36.7-05"
365,6415,"movie","Three Kings",6.6,"https://image.tmdb.org/t/p/w780/d2fSA6N7xUvj5jA62SAsGvLdVk5.jpg","https://image.tmdb.org/t/p/w780/7CPVhTgTU5s1a2chC4yne9FuYV7.jpg","1999-09-27","A group of American soldiers stationed in Iraq at the end of the Gulf War find a map they believe will take them to a huge cache of stolen Kuwaiti gold hidden near their base, and they embark on a secret mission that's destined to change everything.","2017-12-11 16:52:39.69-05","2017-12-11 16:52:39.69-05"
366,136,"movie","Freaks",7.7,"https://image.tmdb.org/t/p/w780/vYmJOrvjHl9trvRsmrmpYoQUCse.jpg","https://image.tmdb.org/t/p/w780/9hmmE4K6tOEXB1KeTajIC0pNta6.jpg","1932-02-20","A circus' beautiful trapeze artist agrees to marry the leader of side-show performers, but his deformed friends discover she is only marrying him for his inheritance.","2017-12-11 16:52:41.189-05","2017-12-11 16:52:41.189-05"
367,658,"movie","Goldfinger",7.3,"https://image.tmdb.org/t/p/w780/iyD72nJFBGbEIrpQjzdhE3wFxPL.jpg","https://image.tmdb.org/t/p/w780/vBNbFU3OS6okJIQBOos1aZXpy2Z.jpg","1964-09-17","Special agent 007 (Sean Connery) comes face to face with one of the most notorious villains of all time, and now he must outwit and outgun the powerful tycoon to prevent him from cashing in on a devious scheme to raid Fort Knox -- and obliterate the world's economy.","2017-12-11 16:52:44.195-05","2017-12-11 16:52:44.195-05"
368,45324,"movie","Casino Jack",6,"https://image.tmdb.org/t/p/w780/4lIfRQ3zNxtNvSuZBR7eW8zPG3T.jpg","https://image.tmdb.org/t/p/w780/fCsqP7OF208vdH4lfRKcYuQBVBi.jpg","2010-09-16","Based on a true story, a hot shot Washington DC lobbyist and his protégé go down hard as their schemes to peddle influence lead to corruption and murder.","2017-12-11 16:52:45.677-05","2017-12-11 16:52:45.677-05"
369,8848,"movie","The Bank Job",6.6,"https://image.tmdb.org/t/p/w780/h3aTGDGZly8ee9EHxIjIK7UaKf2.jpg","https://image.tmdb.org/t/p/w780/zS3mDKTGRTQtnfiIRPnjHZM9r0l.jpg","2008-02-28","Terry is a small-time car dealer trying to leave his shady past behind and start a family. Martine is a beautiful model from Terry's old neighbourhood who knows that Terry is no angel. When Martine proposes a foolproof plan to rob a bank, Terry recognises the danger but realises this may be the opportunity of a lifetime. As the resourceful band of thieves burrows its way into a safe-deposit vault at a Lloyds Bank, they quickly realise that, besides millions in riches, the boxes also contain secrets that implicate everyone from London's most notorious underworld gangsters to powerful government figures, and even the Royal Family. Although the heist makes headlines throughout Britain for several days, a government gag order eventually brings all reporting of the case to an immediate halt.","2017-12-11 16:52:47.194-05","2017-12-11 16:52:47.194-05"
370,242224,"movie","The Babadook",6.5,"https://image.tmdb.org/t/p/w780/pJ10mpKs2mM2AXTUOmM4yl5PJi8.jpg","https://image.tmdb.org/t/p/w780/4zPxsfmeNX438gf77hjb9eYGiLh.jpg","2014-05-22","A single mother, plagued by the violent death of her husband, battles with her son's fear of a monster lurking in the house, but soon discovers a sinister presence all around her.","2017-12-11 16:52:48.787-05","2017-12-11 16:52:48.787-05"
372,9952,"movie","Rescue Dawn",6.8,"https://image.tmdb.org/t/p/w780/bj1ZF5vj23N8pFIGlG2f7IPTtpf.jpg","https://image.tmdb.org/t/p/w780/sNQ1drGljoZ0PpCJoKYtIDiNQ61.jpg","2006-09-09","A US Fighter pilot's epic struggle of survival after being shot down on a mission over Laos during the Vietnam War.","2017-12-11 16:52:54.829-05","2017-12-11 16:52:54.829-05"
373,77875,"movie","Playing for Keeps",5.4,"https://image.tmdb.org/t/p/w780/cWHOiGw3JxKok3BdqFlxSmLKZ1O.jpg","https://image.tmdb.org/t/p/w780/eOBekVFBGK4TwETQSwfuk22B41o.jpg","2012-11-29","A former sports star who's fallen on hard times starts coaching his son's soccer team in an attempt to get his life together.","2017-12-11 16:52:57.728-05","2017-12-11 16:52:57.728-05"
374,13203,"movie","Son in Law",5.6,"https://image.tmdb.org/t/p/w780/fGUsG6pAUL5s5YOQkmuN1KfOkmG.jpg","https://image.tmdb.org/t/p/w780/zVnzFkQqcPC1uxhAuIaWx4H0kEO.jpg","1993-07-02","Country girl Rebecca has spent most of her life on a farm in South Dakota, and, when she goes away to college in Los Angeles, Rebecca immediately feels out of place in the daunting urban setting. She is befriended by a savvy party animal named Crawl, who convinces the ambivalent Rebecca to stay in the city. When Thanksgiving break rolls around, Rebecca, no longer an innocent farm girl, invites Crawl back to South Dakota, where he pretends to be her fiancé.","2017-12-11 16:52:59.181-05","2017-12-11 16:52:59.181-05"
375,38982,"movie","Fresh Horses",4.6,"https://image.tmdb.org/t/p/w780/i2MGq3wR7ne0FKHU2BP2dDbrPPe.jpg","https://image.tmdb.org/t/p/w780/qWd517TCBmv3UABE7W42ZcV1mFG.jpg","1988-11-18","A Cincinnati college student breaks off his engagement to his wealthy fiancée after he falls in love with a backwoods Kentucky girl he meets at a party. She says she's 20, but he finds out she's 16 and married to an abusive husband.","2017-12-11 16:53:02.178-05","2017-12-11 16:53:02.178-05"
376,2616,"movie","Uncle Buck",6.6,"https://image.tmdb.org/t/p/w780/hXijgyAgIgPREv6H7AZN8L2W0Oe.jpg","https://image.tmdb.org/t/p/w780/pfRn0CzYq5n49EDl8BV8Jjry6ZM.jpg","1989-08-16","As an idle, good-natured bachelor, Uncle Buck is the last person you would think of to watch the kids. However, during a family crisis, he is suddenly left in charge of his nephew and nieces. Unaccustomed to suburban life, fun-loving Uncle Buck soon charms his younger relatives Miles and Maizy with his hefty cooking and his new way of doing the laundry. His carefree style does not impress everyone though - especially his rebellious teenage niece, Tia, and his impatient girlfriend, Chanice. With a little bit of luck and a lot of love, Uncle Buck manages to surprise everyone in this heartwarming family comedy.","2017-12-11 16:53:05.182-05","2017-12-11 16:53:05.182-05"
377,17473,"movie","The Room",4.2,"https://image.tmdb.org/t/p/w780/mX7mlE1kaGohnSVDMSTlrvisYf7.jpg","https://image.tmdb.org/t/p/w780/aUC39cFC2KO8CJ0EV0ijIJRr3PT.jpg","2003-06-27","Johnny is a successful banker with great respect for and dedication to the people in his life, especially his future wife Lisa. The happy-go-lucky guy sees his world fall apart when his friends begin to betray him one-by-one.","2017-12-11 16:53:06.691-05","2017-12-11 16:53:06.691-05"
378,11690,"movie","Bloodsport",6.6,"https://image.tmdb.org/t/p/w780/5xrZTFHhAdlg0WtjkkGDqf4Knck.jpg","https://image.tmdb.org/t/p/w780/E4d48dFICxN1tcGywt1p5zBHYJ.jpg","1988-02-26","Frank Dux has entered the ""kumite"", an illegal underground martial-arts competition where serious injury and even death are not unknown. Chong Li, a particularly ruthless and vicious fighter is the favorite, but then again Dux has not fought him yet.","2017-12-11 16:53:08.18-05","2017-12-11 16:53:08.18-05"
379,10218,"movie","Swingers",6.9,"https://image.tmdb.org/t/p/w780/hlyIevjA4zsXlzh6jr8ysQUonoM.jpg","https://image.tmdb.org/t/p/w780/h1nLEgXCNK6sQgup22SYgNTrwJm.jpg","1996-10-18","This is a story about Mike, a guy who left his girl in New York when he came to LA to be a star. It's been six months since his girlfriend left him and he's not doing so good. So, his pal and some other friends try and get him back in the social scene and forget about his 6 year relationship.","2017-12-11 16:53:09.697-05","2017-12-11 16:53:09.697-05"
380,500,"movie","Reservoir Dogs",8.1,"https://image.tmdb.org/t/p/w780/gjOiE5EYH5sqcJYlSDZnVWRMgNV.jpg","https://image.tmdb.org/t/p/w780/tB2ITHg556e7aTV6cqQqVAXkdxN.jpg","1992-09-02","A botched robbery indicates a police informant, and the pressure mounts in the aftermath at a warehouse. Crime begets violence as the survivors -- veteran Mr. White, newcomer Mr. Orange, psychopathic parolee Mr. Blonde, bickering weasel Mr. Pink and Nice Guy Eddie -- unravel.","2017-12-11 16:53:11.182-05","2017-12-11 16:53:11.182-05"
381,13667,"movie","Better Off Dead...",6.8,"https://image.tmdb.org/t/p/w780/A9FCmb5Qz2HTfsNzXaASsl5GIjf.jpg","https://image.tmdb.org/t/p/w780/wNzTq6J7hZskFIAeVAi5xZX8Dye.jpg","1985-10-11","Lane Meyer is obsessed with his girlfriend Beth and is crushed when she falls for the new captain of the ski team, Roy. After several failed suicide attempts, narrow escapes from the relentless paper boy, and nearly unbearable dinners at home with his crazy family, Lane finds a new love in French exchange student Monique Junot. Meanwhile, he must beat Roy on the slopes to regain his honor.","2017-12-11 16:53:12.679-05","2017-12-11 16:53:12.679-05"
382,522,"movie","Ed Wood",7.3,"https://image.tmdb.org/t/p/w780/6zSU6K7q4zntC8vgrvpoUM66eQl.jpg","https://image.tmdb.org/t/p/w780/9qBe2sUDyY2dFH1iHq0SZb1G4QG.jpg","1994-09-27","The mostly true story of the legendary ""worst director of all time"", who, with the help of his strange friends, filmed countless B-movies without ever becoming famous or successful.","2017-12-11 16:53:14.203-05","2017-12-11 16:53:14.203-05"
383,19053,"movie","Valley Girl",6.1,"https://image.tmdb.org/t/p/w780/vx2O1ZStu38FkmP3WBli2knGRgl.jpg","https://image.tmdb.org/t/p/w780/mQSrU9jerYSIOWeLBqFA1gcUU59.jpg","1983-04-08","Julie, a girl from the valley, meets Randy, a punk from the city. They are from different worlds and find love. Somehow they need to stay together in spite of her trendy, shallow friends.","2017-12-11 16:53:15.685-05","2017-12-11 16:53:15.685-05"
384,378,"movie","Raising Arizona",7.2,"https://image.tmdb.org/t/p/w780/2NKBHDZOT0NlhhT5ZEc5jamaUhX.jpg","https://image.tmdb.org/t/p/w780/jsBg2bhvbSncyezo9sMntMzBuy6.jpg","1987-03-01","The Coen Brothers tell the story of a absurd yet likable family with an unproductive couple as the focal point. The couple has gotten themselves into some trouble while kidnapping a baby and give Hollywood one of the most memorable chase scenes to date.","2017-12-11 16:53:17.186-05","2017-12-11 16:53:17.186-05"
385,336011,"movie","White Girl",5.4,"https://image.tmdb.org/t/p/w780/6AMhzoTnXW3Mk8lzLVheHFuhF2h.jpg","https://image.tmdb.org/t/p/w780/tbpza4ApPHcuYNpzXupWH60ZoKy.jpg","2016-09-02","Summer, New York City. A college girl falls hard for a guy she just met. After a night of partying goes wrong, she goes to wild extremes to get him back.","2017-12-11 16:53:21.682-05","2017-12-11 16:53:21.682-05"
386,7453,"movie","The Hitchhiker's Guide to the Galaxy",6.6,"https://image.tmdb.org/t/p/w780/kMf3ewax3ZeiSESaPQxBAReQzDD.jpg","https://image.tmdb.org/t/p/w780/fOb4cJMhnZ11BoHNUii3Vcfo3XU.jpg","2005-04-28","Mere seconds before the Earth is to be demolished by an alien construction crew, Arthur Dent is swept off the planet by his friend Ford Prefect, a researcher penning a new edition of ""The Hitchhiker's Guide to the Galaxy.""","2017-12-11 16:53:23.19-05","2017-12-11 16:53:23.19-05"
387,27583,"movie","Greenberg",6,"https://image.tmdb.org/t/p/w780/n3nW6W0akPuCqY7vRn471AlODRb.jpg","https://image.tmdb.org/t/p/w780/m1eogNKqXzZgFu0juVLcWMdMotV.jpg","2010-03-26","A New Yorker moves to Los Angeles in order to figure out his life while he housesits for his brother, and he soon sparks with his brother's assistant.","2017-12-11 16:53:24.729-05","2017-12-11 16:53:24.729-05"
388,396398,"movie","The Meyerowitz Stories (New and Selected)",6.4,"https://image.tmdb.org/t/p/w780/hwBqtQy8uuQ3g9gzuFoBgn0xHk4.jpg","https://image.tmdb.org/t/p/w780/c9teDTgwxgnb7wnZjZo4oNcF80R.jpg","2017-05-21","An estranged family gathers together in New York for an event celebrating the artistic work of their father.","2017-12-11 16:53:26.172-05","2017-12-11 16:53:26.172-05"
